### ISSUE TITLE
Malformed large BGP communities attributes handling

### ISSUE THREAD

**Issue by pierky** [osrg/gobgp#1147]
I would like to ask your support to analyze a behaviour that seems unexpected to me. It seems GoBGP does not handle malformed large BGP communities attributes in the way I understand the draft wants to.

Draft:

> A BGP UPDATE message with a malformed Large Communities attribute SHALL be handled using the approach of "treat-as-withdraw" as described in section 2 [RFC7606].

RFC7606:

> Treat-as-withdraw: In this approach, the UPDATE message containing the path attribute in question MUST be treated as though all contained routes had been withdrawn just as if they had been listed in the WITHDRAWN ROUTES field (or in the MP_UNREACH_NLRI attribute if appropriate) of the UPDATE message, thus causing them to be removed from the Adj-RIB-In according to the procedures of [RFC4271].

I used an ExaBGP instance to send a malformed attribute; this is the output of tcpdump on the GoBGP host:

```
    192.0.2.2.40208 > 192.0.2.3.179: Flags [P.], cksum 0x8474 (incorrect -> 0x2f47), seq 350:422, ack 65, win 457, options [nop,nop,TS val 5124424 ecr 5123924], length 72: BGP, length: 72
        Update Message (2), length: 72
          Origin (1), length: 1, Flags [T]: IGP
          AS Path (2), length: 6, Flags [T]: 65536
          Next Hop (3), length: 4, Flags [T]: 192.0.2.2
          Unknown Attribute (30), length: 21, Flags [OTP]:
            no Attribute 30 decoder
            0x0000:  0000 0001 0000 0002 0000 0003 0000 0004
            0x0010:  0000 0005 ff
          Updated routes:
            203.0.113.12/32
    192.0.2.3.179 > 192.0.2.2.40208: Flags [P.], cksum 0x8441 (incorrect -> 0xf9e0), seq 65:86, ack 422, win 470, options [nop,nop,TS val 5124425 ecr 5124424], length 21: BGP, length: 21
        Notification Message (3), length: 21, UPDATE Message Error (3), subcode Attribute Length Error (5)
    192.0.2.3.179 > 192.0.2.2.40208: Flags [F.], cksum 0x842c (incorrect -> 0x0200), seq 86, ack 422, win 470, options [nop,nop,TS val 5124425 ecr 5124424], l
```

This is GoBGP's log:

```
WARN[3024] malformed BGP message  Key=192.0.2.2 State=BGP_FSM_ESTABLISHED Topic=Peer error=large communities length isn't correct
WARN[3024] sent notification      Data=&{Header:{Marker:[] Len:21 Type:3} Body:0xc4203f5040} Key=192.0.2.2 State=BGP_FSM_ESTABLISHED Topic=Peer
INFO[3024] Peer Down              Key=192.0.2.2 Reason=notification-sent code 3(update) subcode 5(attribute length error) State=BGP_FSM_ESTABLISHED Topic=Peer
```

It seems that GoBGP, instead of treating the message as a withdraw, drops the BGP session with the sending neighbor.

Thanks.

GoBGP config:

```
[global.config]
        as = 65537
        router-id = "192.0.2.3"

[[neighbors]]
        [neighbors.config]
                neighbor-address = "192.0.2.2"
                peer-as = 65536
```

**Comment by pierky** [comment]
Hi @Darinyazanr, ExaBGP can send handcrafted attributes; you can use the [Docker image](https://hub.docker.com/r/pierky/exabgp/) I've create on my [playground](https://github.com/pierky/large-bgp-communities-playground) and [this configuration](https://github.com/pierky/large-bgp-communities-playground/tree/master/tests/04) (exabgp.conf and malformed-lc files) to send malformed Large BGP Communities attributes.

**Comment by fujita** [comment]
Please try the latest master.

**Comment by pierky** [comment]
Hello, no luck with it.

Session is dropped when a malformed BGP large community is received.

```
time="2017-10-02T16:23:22Z" level=warning msg="Session will be reset due to malformed BGP message" Key=192.0.2.2 State=BGP_FSM_ESTABLISHED Topic=Peer error="large communities length isn't correct"
time="2017-10-02T16:23:22Z" level=warning msg="sent notification" Code=3 Data="[]" Key=192.0.2.2 State=BGP_FSM_ESTABLISHED Subcode=5 Topic=Peer
time="2017-10-02T16:23:22Z" level=info msg="Peer Down" Key=192.0.2.2 Reason="notification-sent code 3(update) subcode 5(attribute length error)" State=BGP_FSM_ESTABLISHED Topic=Peer
time="2017-10-02T16:23:25Z" level=warning msg="Closed an accepted connection" Key=192.0.2.2 State=BGP_FSM_IDLE Topic=Peer
```

tcpdump on the GoBGP host:

```
    192.0.2.2.33734 > gobgp.bgp: Flags [P.], cksum 0x8474 (incorrect
-> 0xf22f), seq 402:474, ack 141, win 229, options [nop,nop,TS val
735754168 ecr 735753167], length 72: BGP
        Update Message (2), length: 72
          Origin (1), length: 1, Flags [T]: IGP
            0x0000:  00
          AS Path (2), length: 6, Flags [T]: 65536
            0x0000:  0201 0001 0000
          Next Hop (3), length: 4, Flags [T]: 192.0.2.2
            0x0000:  c000 0202
          Large Community (32), length: 21, Flags [OTP]: invalid len
            0x0000:  0000 0001 0000 0002 0000 0003 0000 0004
            0x0010:  0000 0005 ff
          Updated routes:
            203.0.113.12/32
```

**Comment by fujimoto-s** [comment]
@pierky
Please confirm that 'treat-as-withdraw' is specified in your neighbor config.

```
[[neighbors]]
  [neighbors.config]
    neighbor-address = "10.0.0.3"
    peer-as = 65501
  [neighbors.error-handling.config]
    treat-as-withdraw = true
```

https://github.com/osrg/gobgp/pull/1415/commits/da3a202b7b7964263ba80d3a214adbc66e073bfc
```
This feature is enabled when 'treat-as-withdraw' in
'neighbors.error-handling.config' is specified to true
in the GoBGP config file.
```

Without it, GoBGP will send NOTIFICATION messages for all malformed UPDATE messages.

Sorry for being unkind.
I think I should write a document about this.

**Comment by pierky** [comment]
Hello @fujimoto-s,

sorry, I didn't notice the new config knob. With that, the behaviour is the expected one.

I also just noticed that it has become true by default, very well, that's the right thing to do!

**Comment by fujimoto-s** [comment]
Thanks for your confirmation!

Yesterday, #1452 has merged, so now `treat-as-withdraw` is true as default.
