### ISSUE TITLE
How can I p2mp via my wireguard tunnel

### ISSUE THREAD

**Issue by DerDennisOP** [osrg/gobgp#3157]
`gobgp neighbor fe80::48c7%wg0` works, but:
`gobgp neighbor fe80::48c7%wg0 adj-in` returns
panic: runtime error: invalid memory address or nil pointer dereference
[signal SIGSEGV: segmentation violation code=0x1 addr=0x8 pc=0xae23e9]

goroutine 1 [running]:
github.com/osrg/gobgp/v3/pkg/apiutil.ToRouteFamily(...)
        github.com/osrg/gobgp/v3/pkg/apiutil/util.go:133
main.showNeighborRib({0xd51ef2, 0x6}, {0xc00040c060, 0xe}, {0xc0002f4900, 0x0, 0x1})
        github.com/osrg/gobgp/v3/cmd/gobgp/neighbor.go:881 +0x1a9
main.newNeighborCmd.func1(0xc0002dd508?, {0xc0002f4900?, 0x1?, 0x1?})
        github.com/osrg/gobgp/v3/cmd/gobgp/neighbor.go:1480 +0x203
github.com/spf13/cobra.(*Command).execute(0xc0002dd508, {0xc0002f48c0, 0x1, 0x1})
        github.com/spf13/cobra@v1.7.0/command.go:944 +0x871
github.com/spf13/cobra.(*Command).ExecuteC(0xc0002dcc08)
        github.com/spf13/cobra@v1.7.0/command.go:1068 +0x398
github.com/spf13/cobra.(*Command).Execute(...)
        github.com/spf13/cobra@v1.7.0/command.go:992
main.newNeighborCmd.func6(0xc000063900?, {0xc0002fe240?, 0x4?, 0xd50821?})
        github.com/osrg/gobgp/v3/cmd/gobgp/neighbor.go:1569 +0xf8
github.com/spf13/cobra.(*Command).execute(0xc0002e1b08, {0xc0002fe1e0, 0x2, 0x2})
        github.com/spf13/cobra@v1.7.0/command.go:944 +0x871
github.com/spf13/cobra.(*Command).ExecuteC(0xc0001cf208)
        github.com/spf13/cobra@v1.7.0/command.go:1068 +0x398
github.com/spf13/cobra.(*Command).Execute(...)
        github.com/spf13/cobra@v1.7.0/command.go:992
main.main()
        github.com/osrg/gobgp/v3/cmd/gobgp/main.go:32 +0xca

wireguard setup:
interface: wg0
  public key: 79V/xxxUAY=
  private key: (hidden)
  listening port: 51820

peer: KNxxxxCHw=
  endpoint: xxxx:51820
  allowed ips: 0.0.0.0/0, ::/0
  latest handshake: 21 seconds ago
  transfer: 11.97 MiB received, 17.10 MiB sent
  persistent keepalive: every 1 second

**Comment by fujita** [comment]
Thanks for the bug report. Please try the latest master branch.

Fixed by https://github.com/osrg/gobgp/commit/162ab974ac45a576d3eff9eee0cc7c8c72071424

**Comment by DerDennisOP** [comment]
well it has fixed one issue, but added another (since i am now on master):
notification-sent code 3(update) subcode 1(malformed attribute list)
I am not able to have a frr neighbor anymore:
```
Neighbor capabilities:
    multiprotocol:
        ipv4-unicast:   advertised and received
    route-refresh:      advertised and received
    extended-nexthop:   advertised
        Local:
            nlri: ipv4-unicast, nexthop: ipv6
    UnknownCapability(6):       received
    graceful-restart:   received
    4-octet-as: advertised and received
    add-path:   received
      Remote:
         ipv4-unicast:  receive
    enhanced-route-refresh:     received
    long-lived-graceful-restart:        received
        Remote:
            ipv4-unicast, restart time 0 sec, forward flag set
    fqdn:       advertised and received
      Local:
         name: r2, domain:
      Remote:
         name: r1, domain: asxxx
    UnknownCapability(76):      received
Message statistics:
                         Sent       Rcvd
    Opens:                  2          2
    Notifications:          2          0
    Updates:                0          0
    Keepalives:             2          2
    Route Refresh:          0          0
    Discarded:              0          2
    Total:                  6          6

```

**Comment by fujita** [comment]
You meant that gobgpd cannot connect to frr on your env? If so, please share a pcap file.

**Comment by DerDennisOP** [comment]
I can't really upload a pcap file here, but this is the tcpdump:
```
12:57:57.623822 IP r1.37750 > r2.bgp: Flags [S], seq 1153797812, win 64240, options [mss 1460,sackOK,TS val 819908963 ecr 0,nop,wscale 7], length 0
12:57:57.623886 IP r2.bgp > r1.37750: Flags [S.], seq 1868328405, ack 1153797813, win 65160, options [mss 1460,sackOK,TS val 3327828325 ecr 819908963,nop,wscale 7], length 0
12:57:57.624014 IP r1.37750 > r2.bgp: Flags [.], ack 1, win 502, options [nop,nop,TS val 819908963 ecr 3327828325], length 0
12:57:57.624136 IP r1.37750 > r2.bgp: Flags [P.], seq 1:112, ack 1, win 502, options [nop,nop,TS val 819908963 ecr 3327828325], length 111: BGP
12:57:57.624149 IP r2.bgp > r1.37750: Flags [.], ack 112, win 509, options [nop,nop,TS val 3327828325 ecr 819908963], length 0
12:57:57.624300 IP r2.bgp > r1.37750: Flags [R.], seq 1, ack 112, win 509, options [nop,nop,TS val 3327828325 ecr 819908963], length 0
12:58:02.557418 IP r2.34189 > r1.bgp: Flags [S], seq 3545901747, win 64240, options [mss 1460,sackOK,TS val 3327833258 ecr 0,nop,wscale 7], length 0
12:58:02.557694 IP r1.bgp > r2.34189: Flags [S.], seq 262599287, ack 3545901748, win 65160, options [mss 1460,sackOK,TS val 819913897 ecr 3327833258,nop,wscale 7], length 0
12:58:02.557741 IP r2.34189 > r1.bgp: Flags [.], ack 1, win 502, options [nop,nop,TS val 3327833259 ecr 819913897], length 0
12:58:02.557880 IP r2.34189 > r1.bgp: Flags [P.], seq 1:64, ack 1, win 502, options [nop,nop,TS val 3327833259 ecr 819913897], length 63: BGP
12:58:02.557979 IP r1.bgp > r2.34189: Flags [.], ack 64, win 509, options [nop,nop,TS val 819913897 ecr 3327833259], length 0
12:58:02.558633 IP r1.bgp > r2.34189: Flags [P.], seq 1:112, ack 64, win 509, options [nop,nop,TS val 819913898 ecr 3327833259], length 111: BGP
12:58:02.558653 IP r2.34189 > r1.bgp: Flags [.], ack 112, win 502, options [nop,nop,TS val 3327833260 ecr 819913898], length 0
12:58:02.558780 IP r1.bgp > r2.34189: Flags [P.], seq 112:131, ack 64, win 509, options [nop,nop,TS val 819913898 ecr 3327833260], length 19: BGP
12:58:02.558804 IP r2.34189 > r1.bgp: Flags [.], ack 131, win 502, options [nop,nop,TS val 3327833260 ecr 819913898], length 0
12:58:02.558842 IP r2.34189 > r1.bgp: Flags [P.], seq 64:83, ack 131, win 502, options [nop,nop,TS val 3327833260 ecr 819913898], length 19: BGP
12:58:02.599602 IP r1.bgp > r2.34189: Flags [.], ack 83, win 509, options [nop,nop,TS val 819913939 ecr 3327833260], length 0
12:58:03.559856 IP r1.bgp > r2.34189: Flags [P.], seq 131:206, ack 83, win 509, options [nop,nop,TS val 819914899 ecr 3327833260], length 75: BGP
12:58:03.560168 IP r2.34189 > r1.bgp: Flags [P.], seq 83:104, ack 206, win 502, options [nop,nop,TS val 3327834261 ecr 819914899], length 21: BGP
12:58:03.560215 IP r2.34189 > r1.bgp: Flags [R.], seq 104, ack 206, win 502, options [nop,nop,TS val 3327834261 ecr 819914899], length 0
12:58:03.560328 IP r1.bgp > r2.34189: Flags [.], ack 104, win 509, options [nop,nop,TS val 819914899 ecr 3327834261], length 0
12:58:03.560350 IP r2.34189 > r1.bgp: Flags [R], seq 3545901851, win 0, length 0
12:58:05.561873 IP r1.33994 > r2.bgp: Flags [S], seq 2639820795, win 64240, options [mss 1460,sackOK,TS val 819916901 ecr 0,nop,wscale 7], length 0
12:58:05.561952 IP r2.bgp > r1.33994: Flags [S.], seq 523781090, ack 2639820796, win 65160, options [mss 1460,sackOK,TS val 3327836263 ecr 819916901,nop,wscale 7], length 0
12:58:05.562103 IP r1.33994 > r2.bgp: Flags [.], ack 1, win 502, options [nop,nop,TS val 819916901 ecr 3327836263], length 0
12:58:05.562290 IP r1.33994 > r2.bgp: Flags [P.], seq 1:112, ack 1, win 502, options [nop,nop,TS val 819916901 ecr 3327836263], length 111: BGP
12:58:05.562313 IP r2.bgp > r1.33994: Flags [.], ack 112, win 509, options [nop,nop,TS val 3327836263 ecr 819916901], length 0
12:58:05.562465 IP r2.bgp > r1.33994: Flags [R.], seq 1, ack 112, win 509, options [nop,nop,TS val 3327836263 ecr 819916901], length 0
12:58:10.552872 IP r2.56869 > r1.bgp: Flags [S], seq 2578997083, win 64240, options [mss 1460,sackOK,TS val 3327841254 ecr 0,nop,wscale 7], length 0
12:58:10.553064 IP r1.bgp > r2.56869: Flags [S.], seq 184818297, ack 2578997084, win 65160, options [mss 1460,sackOK,TS val 819921892 ecr 3327841254,nop,wscale 7], length 0
12:58:10.553103 IP r2.56869 > r1.bgp: Flags [.], ack 1, win 502, options [nop,nop,TS val 3327841254 ecr 819921892], length 0
12:58:10.553272 IP r2.56869 > r1.bgp: Flags [P.], seq 1:64, ack 1, win 502, options [nop,nop,TS val 3327841254 ecr 819921892], length 63: BGP
12:58:10.553369 IP r1.bgp > r2.56869: Flags [.], ack 64, win 509, options [nop,nop,TS val 819921892 ecr 3327841254], length 0
12:58:10.553929 IP r1.bgp > r2.56869: Flags [P.], seq 1:112, ack 64, win 509, options [nop,nop,TS val 819921893 ecr 3327841254], length 111: BGP
12:58:10.553947 IP r2.56869 > r1.bgp: Flags [.], ack 112, win 502, options [nop,nop,TS val 3327841255 ecr 819921893], length 0
12:58:10.554043 IP r2.56869 > r1.bgp: Flags [P.], seq 64:83, ack 112, win 502, options [nop,nop,TS val 3327841255 ecr 819921893], length 19: BGP
12:58:10.554052 IP r1.bgp > r2.56869: Flags [P.], seq 112:131, ack 64, win 509, options [nop,nop,TS val 819921893 ecr 3327841255], length 19: BGP
12:58:10.594567 IP r1.bgp > r2.56869: Flags [.], ack 83, win 509, options [nop,nop,TS val 819921934 ecr 3327841255], length 0
12:58:10.594648 IP r2.56869 > r1.bgp: Flags [.], ack 131, win 502, options [nop,nop,TS val 3327841296 ecr 819921893], length 0

```
where r1 is the frr router and r2 is my machine with gobgp.

**Comment by fujita** [comment]
Unfortunately, tcpdump doesn't give information.

**Comment by DerDennisOP** [comment]
You can download it here:
[download link](https://limewire.com/d/WXUMX#eOz9WfLv05)

also here are additional logs:
```
{"Key":"r1","State":"BGP_FSM_OPENCONFIRM","Topic":"Peer","level":"info","msg":"Peer Up","time":"2025-09-23T13:02:42+02:00"}
{"Error":"prefix misses length field","Key":"r1","State":"BGP_FSM_ESTABLISHED","Topic":"Peer","level":"warning","msg":"Session will be reset >
Sep 23 13:02:43 photon gobgpd[94674]: {"Key":"r1","Reason":"notification-sent code 3(update) subcode 1(malformed attribute list)","State":"BGP_FSM_ESTABLISHED","Topic":"Peer","lev>
Sep 23 13:02:45 photon gobgpd[94674]: {"Key":"r1","State":"BGP_FSM_IDLE","Topic":"Peer","level":"warning","msg":"Closed an accepted connection","time":"2025-09-23T13:02:45+02:00"}
Sep 23 13:02:50 photon gobgpd[94674]: {"Key":"r1","State":"BGP_FSM_OPENCONFIRM","Topic":"Peer","level":"info","msg":"Peer Up","time":"2025-09-23T13:02:50+02:00"}
Sep 23 13:02:51 photon gobgpd[94674]: {"Error":"prefix misses length field","Key":"r1","State":"BGP_FSM_ESTABLISHED","Topic":"Peer","level":"warning","msg":"Session will be reset >
Sep 23 13:02:51 photon gobgpd[94674]: {"Key":"r1","Reason":"notification-sent code 3(update) subcode 1(malformed attribute list)","State":"BGP_FSM_ESTABLISHED","Topic":"Peer","lev>
Sep 23 13:02:53 photon gobgpd[94674]: {"Key":"r1","State":"BGP_FSM_IDLE","Topic":"Peer","level":"warning","msg":"Closed an accepted connection","time":"2025-09-23T13:02:53+02:00"}
```

**Comment by fujita** [comment]
Sorry, I can't help if you can't upload the pcap file.

**Comment by DerDennisOP** [comment]
I edited above message

**Comment by DerDennisOP** [comment]
gobgp global rib add 10.0.0.0/24 nexthop fe80::48c7%wg0
error: invalid nexthop address

is this suppose to be like this?

**Comment by fujita** [comment]
> You can download it here: [download link](https://limewire.com/d/WXUMX#eOz9WfLv05)
> 
> also here are additional logs:
> 
> ```
> {"Key":"r1","State":"BGP_FSM_OPENCONFIRM","Topic":"Peer","level":"info","msg":"Peer Up","time":"2025-09-23T13:02:42+02:00"}
> {"Error":"prefix misses length field","Key":"r1","State":"BGP_FSM_ESTABLISHED","Topic":"Peer","level":"warning","msg":"Session will be reset >
> Sep 23 13:02:43 photon gobgpd[94674]: {"Key":"r1","Reason":"notification-sent code 3(update) subcode 1(malformed attribute list)","State":"BGP_FSM_ESTABLISHED","Topic":"Peer","lev>
> Sep 23 13:02:45 photon gobgpd[94674]: {"Key":"r1","State":"BGP_FSM_IDLE","Topic":"Peer","level":"warning","msg":"Closed an accepted connection","time":"2025-09-23T13:02:45+02:00"}
> Sep 23 13:02:50 photon gobgpd[94674]: {"Key":"r1","State":"BGP_FSM_OPENCONFIRM","Topic":"Peer","level":"info","msg":"Peer Up","time":"2025-09-23T13:02:50+02:00"}
> Sep 23 13:02:51 photon gobgpd[94674]: {"Error":"prefix misses length field","Key":"r1","State":"BGP_FSM_ESTABLISHED","Topic":"Peer","level":"warning","msg":"Session will be reset >
> Sep 23 13:02:51 photon gobgpd[94674]: {"Key":"r1","Reason":"notification-sent code 3(update) subcode 1(malformed attribute list)","State":"BGP_FSM_ESTABLISHED","Topic":"Peer","lev>
> Sep 23 13:02:53 photon gobgpd[94674]: {"Key":"r1","State":"BGP_FSM_IDLE","Topic":"Peer","level":"warning","msg":"Closed an accepted connection","time":"2025-09-23T13:02:53+02:00"}
> ```

Thanks for the pcap file. Please try the current master.

The bug was fixed by https://github.com/osrg/gobgp/commit/20b392bcad517cfcd5b02da3f6e66a1df30be89e

**Comment by fujita** [comment]
> gobgp global rib add 10.0.0.0/24 nexthop fe80::48c7%wg0 error: invalid nexthop address
> 
> is this suppose to be like this?

Yeah, let me know if you find a BGP implementation that advertises a prefix with the above nexthop.

**Comment by DerDennisOP** [comment]
Great! The fix works. I got following setup:

```
fe80::48c7 > gobgp neighbor
Peer               AS  Up/Down State       |#Received  Accepted
xxxx             xxxxx 00:00:48 Establ      |        1         1
fe80::48ca%wg0  64646 00:00:12 Establ      |        0         0
```

```
fe80:48c7 > gobgp neighbor fe80::48ca%wg0
  Neighbor capabilities:
    multiprotocol:
        ipv4-unicast:   advertised and received
    route-refresh:      advertised and received
    extended-nexthop:   advertised and received
        Local:
            nlri: ipv4-unicast, nexthop: ipv6
        Remote:
            nlri: ipv4-unicast, nexthop: ipv6
    4-octet-as: advertised and received
    fqdn:       advertised and received
       ....
    software-version:   advertised
      Local:
         GoBGP/3.37.0
```

and i would like to advertise lets say 10.23.12.1/32 on fe80::48ca%wg0. It would be great to get some help, as it was working with frr, but not a big fan of frr.

evertime i try: gobpg global rib, it has no addresses listed

**Comment by fujita** [comment]
Hmm, please upload a pcap file where frr advertises 10.23.12.1/32 with fe80::48ca%wg0 nexthop to another frr.

**Comment by DerDennisOP** [comment]
Yeah, sorry i tried to reproduce it. But currently my frr (no matter what i change is failing with `wg0(5): Tx RA failed, socket 12 error 126 (Required key not available)` (the are not even establishing a connection)). I'm using NixOS and even switched to an older version (which should recover the configurations to back than when it worked) but doesn't seem to work. But here is my config:
```
        router bgp 64646
          bgp router-id r2
          no bgp ebgp-requires-policy
          no bgp default ipv4-unicast
          no bgp network import-check
          !
          neighbor r1 remote-as [AS num]
          !
          neighbor fabric peer-group
          neighbor fabric remote-as internal
          neighbor wg0 interface peer-group fabric
          !
          address-family ipv4 unicast
            neighbor r1 activate
            neighbor r1 soft-reconfiguration inbound
            neighbor r1 prefix-list as203218-wavelens in
            neighbor r1 prefix-list wavelens-as203218 out
            !
            neighbor fabric activate
            neighbor fabric soft-reconfiguration inbound
          exit-address-family
        exit
        !
        end
```

As you can see i don't specify p2p, but rather a p2mp (by saying it should use interface wg0) and on the other side i just do the following:
```
        router bgp 64646
          no bgp ebgp-requires-policy
          no bgp default ipv4-unicast
          no bgp network import-check
          !
          neighbor fe80::48c7 peer-group
          neighbor fe80::48c7 remote-as internal
          neighbor fe80::48c7 interface wg0
          neighbor fe80::48c7 capability extended-nexthop
          !
          address-family ipv4 unicast
            network 10.23.12.1/32
            !
            neighbor fe80::48c7 activate
            neighbor fe80::48c7 soft-reconfiguration inbound
          exit-address-family
        exit
        !
        end
```

**Comment by fujita** [comment]
I don't know how BGP can advertise a prefix with fe80::48ca%wg0 nexthop.

**Comment by DerDennisOP** [comment]
I will try to send the pcap to you asap.

**Comment by DerDennisOP** [comment]
> I don't know how BGP can advertise a prefix with fe80::48ca%wg0 nexthop.

I'm using local link peering:
https://www.cisco.com/c/en/us/td/docs/ios-xml/ios/iproute_bgp/configuration/xe-3s/irg-xe-3s-book/ipv-routing-multiprotocol-bgp-link-local-address-peering.pdf

do you know if it needs to support extra capabilities? Do you have a workaround in mind?

**Comment by DerDennisOP** [comment]
I started using zebra, but I am getting weird messages in log:
```
Sep 25 02:09:10 gluon zebra[866614]: [PE6Y7-KR1RK] Zebra received unknown command 18
Sep 25 02:09:10 gluon zebra[866614]: [KMSKA-RYR7X][EC 4043309147] zebra_redistribute_default_delete: Specified afi 0 does not exist
Sep 25 02:09:10 gluon zebra[866614]: [KMSKA-RYR7X][EC 4043309147] zebra_redistribute_default_delete: Specified afi 0 does not exist
Sep 25 02:09:10 gluon zebra[866614]: [PE6Y7-KR1RK] Zebra received unknown command 11
Sep 25 02:09:10 gluon zebra[866614]: [PE6Y7-KR1RK] Zebra received unknown command 11
Sep 25 02:09:10 gluon zebra[866614]: [PE6Y7-KR1RK] Zebra received unknown command 11
Sep 25 02:09:10 gluon zebra[866614]: [PE6Y7-KR1RK] Zebra received unknown command 11
Sep 25 02:09:46 gluon zebra[866614]: [HSMCT-F8EZK] Cannot set protodown off for interface 150994944; does not exist
Sep 25 02:09:46 gluon zebra[866614]: [PE6Y7-KR1RK] Zebra received unknown command 20
Sep 25 02:10:13 gluon zebra[866614]: [HSMCT-F8EZK] Cannot set protodown off for interface 150994944; does not exist
Sep 25 02:10:13 gluon zebra[866614]: [PE6Y7-KR1RK] Zebra received unknown command 20
```

I have following FRR version: `FRRouting 10.4.1 on Linux(6.12.46)` , I have set the version to 6 (in gobgp config) for zebra api, which seems to match, since it can connect, but it's just routing half the stuff it is suppose to route.

btw nexthop has to be 0.0.0.0 instead of fe80::48ca%wg0. but now it does not show up in adj-in nor adj-out nor global rib.

**Comment by DerDennisOP** [comment]
Here are the pcaps: [download](https://limewire.com/d/FGLV5#xOVEEVYkZJ)

r3 (sets the nexthop locally) and r2 sets it to the local ip of r3 192.168.1.110 (which isn't even pingable on r2)

**Comment by fujita** [comment]
r2 sends a ipv4 route with ipv4 nexthop over the ipv6 connection. With GoBGP, you can add a ipv4 route with ipv4 next hop specified via AddPath API.
But I don't know it works if you try to run GoBGP with zebra in such env.
