### ISSUE TITLE
Could not connect together two servers with gobgp due to TTL validation

### ISSUE THREAD

**Issue by pavel-odintsov** [osrg/gobgp#304]
Hello, BGP Gurus :)

I have installed two servers with gobgp: 178.62.227.110 and 213.133.111.200

I have following configuration files:
```bash
[Global]
  [Global.GlobalConfig]
    As = 65001
    RouterId = "178.62.227.110"

[Neighbors]
  [[Neighbors.NeighborList]]
    [Neighbors.NeighborList.NeighborConfig]
      NeighborAddress = "213.133.111.200"
      PeerAs = 65002
```

And this:
```bash
[Global]
  [Global.GlobalConfig]
    As = 65002
    RouterId = "213.133.111.200"

[Neighbors]
  [[Neighbors.NeighborList]]
    [Neighbors.NeighborList.NeighborConfig]
      NeighborAddress = "178.62.227.110"
      PeerAs = 65001
```

Output:
```
gobgpd  
{"level":"info","msg":"Peer 213.133.111.200 is added","time":"2015-09-02T00:26:25+03:00"}
{"Key":"213.133.111.200","State":4,"Topic":"Peer","level":"warning","msg":"Closed an accepted connection","time":"2015-09-02T00:26:56+03:00"}
{"Data":"hold timer expired","Key":"213.133.111.200","Topic":"Peer","level":"warning","msg":"sent notification","time":"2015-09-02T00:30:31+03:00"
}
{"Key":"213.133.111.200","State":4,"Topic":"Peer","level":"warning","msg":"Closed an accepted connection","time":"2015-09-02T00:31:11+03:00"}
{"Data":"hold timer expired","Key":"213.133.111.200","Topic":"Peer","level":"warning","msg":"sent notification","time":"2015-09-02T00:34:46+03:00"
}
{"Key":"213.133.111.200","State":4,"Topic":"Peer","level":"warning","msg":"Closed an accepted connection","time":"2015-09-02T00:35:26+03:00"}
{"Data":"hold timer expired","Key":"213.133.111.200","Topic":"Peer","level":"warning","msg":"sent notification","time":"2015-09-02T00:39:02+03:00"
}
{"Key":"213.133.111.200","State":4,"Topic":"Peer","level":"warning","msg":"Closed an accepted connection","time":"2015-09-02T00:39:41+03:00"}
{"Data":"hold timer expired","Key":"213.133.111.200","Topic":"Peer","level":"warning","msg":"sent notification","time":"2015-09-02T00:43:17+03:00"
}
{"Key":"213.133.111.200","State":4,"Topic":"Peer","level":"warning","msg":"Closed an accepted connection","time":"2015-09-02T00:43:56+03:00"}
{"Data":"hold timer expired","Key":"213.133.111.200","Topic":"Peer","level":"warning","msg":"sent notification","time":"2015-09-02T00:47:32+03:00"
}
{"Key":"213.133.111.200","State":4,"Topic":"Peer","level":"warning","msg":"Closed an accepted connection","time":"2015-09-02T00:48:11+03:00"}
```

Second:
```bash
gobgpd 
{"level":"info","msg":"Peer 178.62.227.110 is added","time":"2015-09-01T23:26:52+02:00"}
{"Key":"178.62.227.110","State":4,"Topic":"Peer","level":"warning","msg":"Closed an accepted connection","time":"2015-09-01T23:30:52+02:00"}
{"Data":"hold timer expired","Key":"178.62.227.110","Topic":"Peer","level":"warning","msg":"sent notification","time":"2015-09-01T23:31:02+02:00"}
2015/09/01 23:32:54 transport: http2Server.HandleStreams failed to receive the preface from client: read tcp 213.133.111.200:8080->104.238.116.143:63476: read: connection reset by peer
{"Key":"178.62.227.110","State":4,"Topic":"Peer","level":"warning","msg":"Closed an accepted connection","time":"2015-09-01T23:35:07+02:00"}
{"Data":"hold timer expired","Key":"178.62.227.110","Topic":"Peer","level":"warning","msg":"sent notification","time":"2015-09-01T23:35:17+02:00"}
{"Key":"178.62.227.110","State":4,"Topic":"Peer","level":"warning","msg":"Closed an accepted connection","time":"2015-09-01T23:39:22+02:00"}
{"Data":"hold timer expired","Key":"178.62.227.110","Topic":"Peer","level":"warning","msg":"sent notification","time":"2015-09-01T23:39:32+02:00"}
{"Key":"178.62.227.110","State":4,"Topic":"Peer","level":"warning","msg":"Closed an accepted connection","time":"2015-09-01T23:43:37+02:00"}
{"Data":"hold timer expired","Key":"178.62.227.110","Topic":"Peer","level":"warning","msg":"sent notification","time":"2015-09-01T23:43:47+02:00"}
{"Key":"178.62.227.110","State":4,"Topic":"Peer","level":"warning","msg":"Closed an accepted connection","time":"2015-09-01T23:47:52+02:00"}
{"Data":"hold timer expired","Key":"178.62.227.110","Topic":"Peer","level":"warning","msg":"sent notification","time":"2015-09-01T23:48:02+02:00"}
```

And I have tshark output which parses BGP nicely:
```bash
tshark 'port 179'
Running as user "root" and group "root". This could be dangerous.
Capturing on 'eth0'
  1   0.000000 178.62.227.110 -> 213.133.111.200 BGP 111 OPEN Message
  2   0.425042 178.62.227.110 -> 213.133.111.200 BGP 111 [TCP Retransmission] OPEN Message
2   3   1.276011 178.62.227.110 -> 213.133.111.200 BGP 111 [TCP Retransmission] OPEN Message
3   4   2.976015 178.62.227.110 -> 213.133.111.200 BGP 111 [TCP Retransmission] OPEN Message
4   5   6.376036 178.62.227.110 -> 213.133.111.200 BGP 111 [TCP Retransmission] OPEN Message
5   6  13.168113 178.62.227.110 -> 213.133.111.200 BGP 111 [TCP Retransmission] OPEN Message
6   7  24.427626 213.133.111.200 -> 178.62.227.110 TCP 74 50664 > bgp [SYN] Seq=0 Win=14600 Len=0 MSS=1460 SACK_PERM=1 TSval=632155582 TSecr=0 WS=128
  8  24.427755 178.62.227.110 -> 213.133.111.200 TCP 74 bgp > 50664 [SYN, ACK] Seq=0 Ack=1 Win=14480 Len=0 MSS=1460 SACK_PERM=1 TSval=3244285243 TSecr=632155582 WS=256
  9  24.439089 213.133.111.200 -> 178.62.227.110 TCP 66 50664 > bgp [ACK] Seq=1 Ack=1 Win=14720 Len=0 TSval=632155594 TSecr=3244285243
 10  24.439745 178.62.227.110 -> 213.133.111.200 TCP 66 bgp > 50664 [FIN, ACK] Seq=1 Ack=1 Win=14592 Len=0 TSval=3244285255 TSecr=632155594
10  11  24.863041 178.62.227.110 -> 213.133.111.200 TCP 66 [TCP Retransmission] bgp > 50664 [FIN, ACK] Seq=1 Ack=1 Win=14592 Len=0 TSval=3244285679 TSecr=632155594
 12  25.288030 178.62.227.110 -> 213.133.111.200 TCP 66 [TCP Retransmission] bgp > 50664 [FIN, ACK] Seq=1 Ack=1 Win=14592 Len=0 TSval=3244286104 TSecr=632155594
12  13  26.138017 178.62.227.110 -> 213.133.111.200 TCP 66 [TCP Retransmission] bgp > 50664 [FIN, ACK] Seq=1 Ack=1 Win=14592 Len=0 TSval=3244286954 TSecr=632155594
13  14  26.768048 178.62.227.110 -> 213.133.111.200 BGP 111 [TCP Retransmission] OPEN Message
14  15  27.840147 178.62.227.110 -> 213.133.111.200 TCP 66 [TCP Retransmission] bgp > 50664 [FIN, ACK] Seq=1 Ack=1 Win=14592 Len=0 TSval=3244288656 TSecr=632155594
15  16  31.240051 178.62.227.110 -> 213.133.111.200 TCP 66 [TCP Retransmission] bgp > 50664 [FIN, ACK] Seq=1 Ack=1 Win=14592 Len=0 TSval=3244292056 TSecr=632155594
16  17  38.032039 178.62.227.110 -> 213.133.111.200 TCP 66 [TCP Retransmission] bgp > 50664 [FIN, ACK] Seq=1 Ack=1 Win=14592 Len=0 TSval=3244298848 TSecr=632155594
17  18  51.632040 178.62.227.110 -> 213.133.111.200 TCP 66 [TCP Retransmission] bgp > 50664 [FIN, ACK] Seq=1 Ack=1 Win=14592 Len=0 TSval=3244312448 TSecr=632155594
18  19  53.936053 178.62.227.110 -> 213.133.111.200 BGP 111 [TCP Retransmission] OPEN Message
19  20  78.832046 178.62.227.110 -> 213.133.111.200 TCP 66 [TCP Retransmission] bgp > 50664 [FIN, ACK] Seq=1 Ack=1 Win=14592 Len=0 TSval=3244339648 TSecr=632155594
20  21 108.336043 178.62.227.110 -> 213.133.111.200 BGP 111 [TCP Retransmission] OPEN Message
21  22 217.136090 178.62.227.110 -> 213.133.111.200 BGP 111 [TCP Retransmission] OPEN Message
22  23 239.577566 178.62.227.110 -> 213.133.111.200 BGP 87 NOTIFICATION Message
23  24 254.579118 178.62.227.110 -> 213.133.111.200 TCP 74 57583 > bgp [SYN] Seq=0 Win=14600 Len=0 MSS=1460 SACK_PERM=1 TSval=3244515395 TSecr=0 WS=256
 25 254.590743 213.133.111.200 -> 178.62.227.110 TCP 74 bgp > 57583 [SYN, ACK] Seq=0 Ack=1 Win=14480 Len=0 MSS=1460 SACK_PERM=1 TSval=632385748 TSecr=3244515395 WS=128
 26 254.590852 178.62.227.110 -> 213.133.111.200 TCP 66 57583 > bgp [ACK] Seq=1 Ack=1 Win=14848 Len=0 TSval=3244515406 TSecr=632385748
 27 254.591367 178.62.227.110 -> 213.133.111.200 BGP 111 OPEN Message
 28 254.802020 178.62.227.110 -> 213.133.111.200 BGP 111 [TCP Retransmission] OPEN Message
 29 255.013033 178.62.227.110 -> 213.133.111.200 BGP 111 [TCP Retransmission] OPEN Message
29  30 255.436030 178.62.227.110 -> 213.133.111.200 BGP 111 [TCP Retransmission] OPEN Message
30  31 256.282019 178.62.227.110 -> 213.133.111.200 BGP 111 [TCP Retransmission] OPEN Message
31  32 257.976040 178.62.227.110 -> 213.133.111.200 BGP 111 [TCP Retransmission] OPEN Message
32  33 261.360036 178.62.227.110 -> 213.133.111.200 BGP 111 [TCP Retransmission] OPEN Message
33  34 268.128023 178.62.227.110 -> 213.133.111.200 BGP 111 [TCP Retransmission] OPEN Message
34  35 279.437928 213.133.111.200 -> 178.62.227.110 TCP 74 50665 > bgp [SYN] Seq=0 Win=14600 Len=0 MSS=1460 SACK_PERM=1 TSval=632410595 TSecr=0 WS=128
 36 279.438032 178.62.227.110 -> 213.133.111.200 TCP 74 bgp > 50665 [SYN, ACK] Seq=0 Ack=1 Win=14480 Len=0 MSS=1460 SACK_PERM=1 TSval=3244540253 TSecr=632410595 WS=256
 37 279.449399 213.133.111.200 -> 178.62.227.110 TCP 66 50665 > bgp [ACK] Seq=1 Ack=1 Win=14720 Len=0 TSval=632410607 TSecr=3244540253
 38 279.450148 178.62.227.110 -> 213.133.111.200 TCP 66 bgp > 50665 [FIN, ACK] Seq=1 Ack=1 Win=14592 Len=0 TSval=3244540266 TSecr=632410607
38  39 279.874053 178.62.227.110 -> 213.133.111.200 TCP 66 [TCP Retransmission] bgp > 50665 [FIN, ACK] Seq=1 Ack=1 Win=14592 Len=0 TSval=3244540690 TSecr=632410607
 40 280.299032 178.62.227.110 -> 213.133.111.200 TCP 66 [TCP Retransmission] bgp > 50665 [FIN, ACK] Seq=1 Ack=1 Win=14592 Len=0 TSval=3244541115 TSecr=632410607
40  41 281.148027 178.62.227.110 -> 213.133.111.200 TCP 66 [TCP Retransmission] bgp > 50665 [FIN, ACK] Seq=1 Ack=1 Win=14592 Len=0 TSval=3244541964 TSecr=632410607
41  42 281.648032 178.62.227.110 -> 213.133.111.200 BGP 111 [TCP Retransmission] OPEN Message
42  43 282.848032 178.62.227.110 -> 213.133.111.200 TCP 66 [TCP Retransmission] bgp > 50665 [FIN, ACK] Seq=1 Ack=1 Win=14592 Len=0 TSval=3244543664 TSecr=632410607
43  44 286.248027 178.62.227.110 -> 213.133.111.200 TCP 66 [TCP Retransmission] bgp > 50665 [FIN, ACK] Seq=1 Ack=1 Win=14592 Len=0 TSval=3244547064 TSecr=632410607
44  45 293.040063 178.62.227.110 -> 213.133.111.200 TCP 66 [TCP Retransmission] bgp > 50665 [FIN, ACK] Seq=1 Ack=1 Win=14592 Len=0 TSval=3244553856 TSecr=632410607
45  46 306.640031 178.62.227.110 -> 213.133.111.200 TCP 66 [TCP Retransmission] bgp > 50665 [FIN, ACK] Seq=1 Ack=1 Win=14592 Len=0 TSval=3244567456 TSecr=632410607
46  47 308.720124 178.62.227.110 -> 213.133.111.200 BGP 111 [TCP Retransmission] OPEN Message
47  48 333.872035 178.62.227.110 -> 213.133.111.200 TCP 66 [TCP Retransmission] bgp > 50665 [FIN, ACK] Seq=1 Ack=1 Win=14592 Len=0 TSval=3244594688 TSecr=632410607
48  49 362.800032 178.62.227.110 -> 213.133.111.200 BGP 111 [TCP Retransmission] OPEN Message
49  50 471.088235 178.62.227.110 -> 213.133.111.200 BGP 111 [TCP Retransmission] OPEN Message
50  51 494.592432 178.62.227.110 -> 213.133.111.200 BGP 87 NOTIFICATION Message
51  52 509.593690 178.62.227.110 -> 213.133.111.200 TCP 74 57584 > bgp [SYN] Seq=0 Win=14600 Len=0 MSS=1460 SACK_PERM=1 TSval=3244770409 TSecr=0 WS=256
 53 509.605036 213.133.111.200 -> 178.62.227.110 TCP 74 bgp > 57584 [SYN, ACK] Seq=0 Ack=1 Win=14480 Len=0 MSS=1460 SACK_PERM=1 TSval=632640765 TSecr=3244770409 WS=128
 54 509.605163 178.62.227.110 -> 213.133.111.200 TCP 66 57584 > bgp [ACK] Seq=1 Ack=1 Win=14848 Len=0 TSval=3244770421 TSecr=632640765
 55 509.606015 178.62.227.110 -> 213.133.111.200 BGP 111 OPEN Message
 56 509.818027 178.62.227.110 -> 213.133.111.200 BGP 111 [TCP Retransmission] OPEN Message
 57 510.030039 178.62.227.110 -> 213.133.111.200 BGP 111 [TCP Retransmission] OPEN Message
57  58 510.455008 178.62.227.110 -> 213.133.111.200 BGP 111 [TCP Retransmission] OPEN Message
58  59 511.304040 178.62.227.110 -> 213.133.111.200 BGP 111 [TCP Retransmission] OPEN Message
59  60 513.004039 178.62.227.110 -> 213.133.111.200 BGP 111 [TCP Retransmission] OPEN Message
60  61 516.399992 178.62.227.110 -> 213.133.111.200 BGP 111 [TCP Retransmission] OPEN Message
61  62 523.200016 178.62.227.110 -> 213.133.111.200 BGP 111 [TCP Retransmission] OPEN Message
62  63 534.447596 213.133.111.200 -> 178.62.227.110 TCP 74 50666 > bgp [SYN] Seq=0 Win=14600 Len=0 MSS=1460 SACK_PERM=1 TSval=632665608 TSecr=0 WS=128
 64 534.447831 178.62.227.110 -> 213.133.111.200 TCP 74 bgp > 50666 [SYN, ACK] Seq=0 Ack=1 Win=14480 Len=0 MSS=1460 SACK_PERM=1 TSval=3244795263 TSecr=632665608 WS=256
 65 534.459353 213.133.111.200 -> 178.62.227.110 TCP 66 50666 > bgp [ACK] Seq=1 Ack=1 Win=14720 Len=0 TSval=632665620 TSecr=3244795263
 66 534.459776 178.62.227.110 -> 213.133.111.200 TCP 66 bgp > 50666 [FIN, ACK] Seq=1 Ack=1 Win=14592 Len=0 TSval=3244795275 TSecr=632665620
 67 534.883018 178.62.227.110 -> 213.133.111.200 TCP 66 [TCP Retransmission] bgp > 50666 [FIN, ACK] Seq=1 Ack=1 Win=14592 Len=0 TSval=3244795699 TSecr=632665620
67  68 535.308026 178.62.227.110 -> 213.133.111.200 TCP 66 [TCP Retransmission] bgp > 50666 [FIN, ACK] Seq=1 Ack=1 Win=14592 Len=0 TSval=3244796124 TSecr=632665620
68  69 536.158033 178.62.227.110 -> 213.133.111.200 TCP 66 [TCP Retransmission] bgp > 50666 [FIN, ACK] Seq=1 Ack=1 Win=14592 Len=0 TSval=3244796974 TSecr=632665620
69  70 536.816035 178.62.227.110 -> 213.133.111.200 BGP 111 [TCP Retransmission] OPEN Message
70  71 537.856021 178.62.227.110 -> 213.133.111.200 TCP 66 [TCP Retransmission] bgp > 50666 [FIN, ACK] Seq=1 Ack=1 Win=14592 Len=0 TSval=3244798672 TSecr=632665620
71  72 541.256033 178.62.227.110 -> 213.133.111.200 TCP 66 [TCP Retransmission] bgp > 50666 [FIN, ACK] Seq=1 Ack=1 Win=14592 Len=0 TSval=3244802072 TSecr=632665620
72  73 548.048000 178.62.227.110 -> 213.133.111.200 TCP 66 [TCP Retransmission] bgp > 50666 [FIN, ACK] Seq=1 Ack=1 Win=14592 Len=0 TSval=3244808864 TSecr=632665620
73  74 561.648041 178.62.227.110 -> 213.133.111.200 TCP 66 [TCP Retransmission] bgp > 50666 [FIN, ACK] Seq=1 Ack=1 Win=14592 Len=0 TSval=3244822464 TSecr=632665620
74  75 564.016039 178.62.227.110 -> 213.133.111.200 BGP 111 [TCP Retransmission] OPEN Message
75  76 588.848041 178.62.227.110 -> 213.133.111.200 TCP 66 [TCP Retransmission] bgp > 50666 [FIN, ACK] Seq=1 Ack=1 Win=14592 Len=0 TSval=3244849664 TSecr=632665620
76  77 618.416041 178.62.227.110 -> 213.133.111.200 BGP 111 [TCP Retransmission] OPEN Message
77  78 727.088015 178.62.227.110 -> 213.133.111.200 BGP 111 [TCP Retransmission] OPEN Message
78  79 749.608030 178.62.227.110 -> 213.133.111.200 BGP 87 NOTIFICATION Message
79  80 764.609857 178.62.227.110 -> 213.133.111.200 TCP 74 57585 > bgp [SYN] Seq=0 Win=14600 Len=0 MSS=1460 SACK_PERM=1 TSval=3245025425 TSecr=0 WS=256
 81 764.621127 213.133.111.200 -> 178.62.227.110 TCP 74 bgp > 57585 [SYN, ACK] Seq=0 Ack=1 Win=14480 Len=0 MSS=1460 SACK_PERM=1 TSval=632895784 TSecr=3245025425 WS=128
 82 764.621237 178.62.227.110 -> 213.133.111.200 TCP 66 57585 > bgp [ACK] Seq=1 Ack=1 Win=14848 Len=0 TSval=3245025437 TSecr=632895784
 83 764.621632 178.62.227.110 -> 213.133.111.200 BGP 111 OPEN Message
 84 764.833034 178.62.227.110 -> 213.133.111.200 BGP 111 [TCP Retransmission] OPEN Message
 85 765.045024 178.62.227.110 -> 213.133.111.200 BGP 111 [TCP Retransmission] OPEN Message
85  86 765.470033 178.62.227.110 -> 213.133.111.200 BGP 111 [TCP Retransmission] OPEN Message
86  87 766.320030 178.62.227.110 -> 213.133.111.200 BGP 111 [TCP Retransmission] OPEN Message
87  88 768.020019 178.62.227.110 -> 213.133.111.200 BGP 111 [TCP Retransmission] OPEN Message
88  89 771.424032 178.62.227.110 -> 213.133.111.200 BGP 111 [TCP Retransmission] OPEN Message
89  90 778.224043 178.62.227.110 -> 213.133.111.200 BGP 111 [TCP Retransmission] OPEN Message
90  91 789.457478 213.133.111.200 -> 178.62.227.110 TCP 74 50667 > bgp [SYN] Seq=0 Win=14600 Len=0 MSS=1460 SACK_PERM=1 TSval=632920621 TSecr=0 WS=128
 92 789.457636 178.62.227.110 -> 213.133.111.200 TCP 74 bgp > 50667 [SYN, ACK] Seq=0 Ack=1 Win=14480 Len=0 MSS=1460 SACK_PERM=1 TSval=3245050273 TSecr=632920621 WS=256
 93 789.468892 213.133.111.200 -> 178.62.227.110 TCP 66 50667 > bgp [ACK] Seq=1 Ack=1 Win=14720 Len=0 TSval=632920632 TSecr=3245050273
 94 789.469753 178.62.227.110 -> 213.133.111.200 TCP 66 bgp > 50667 [FIN, ACK] Seq=1 Ack=1 Win=14592 Len=0 TSval=3245050285 TSecr=632920632
 95 789.891046 178.62.227.110 -> 213.133.111.200 TCP 66 [TCP Retransmission] bgp > 50667 [FIN, ACK] Seq=1 Ack=1 Win=14592 Len=0 TSval=3245050707 TSecr=632920632
95  96 790.313997 178.62.227.110 -> 213.133.111.200 TCP 66 [TCP Retransmission] bgp > 50667 [FIN, ACK] Seq=1 Ack=1 Win=14592 Len=0 TSval=3245051130 TSecr=632920632
96  97 791.160007 178.62.227.110 -> 213.133.111.200 TCP 66 [TCP Retransmission] bgp > 50667 [FIN, ACK] Seq=1 Ack=1 Win=14592 Len=0 TSval=3245051976 TSecr=632920632
97  98 791.824058 178.62.227.110 -> 213.133.111.200 BGP 111 [TCP Retransmission] OPEN Message
98  99 792.852113 178.62.227.110 -> 213.133.111.200 TCP 66 [TCP Retransmission] bgp > 50667 [FIN, ACK] Seq=1 Ack=1 Win=14592 Len=0 TSval=3245053668 TSecr=632920632
99 100 796.240163 178.62.227.110 -> 213.133.111.200 TCP 66 [TCP Retransmission] bgp > 50667 [FIN, ACK] Seq=1 Ack=1 Win=14592 Len=0 TSval=3245057056 TSecr=632920632
100 101 803.008010 178.62.227.110 -> 213.133.111.200 TCP 66 [TCP Retransmission] bgp > 50667 [FIN, ACK] Seq=1 Ack=1 Win=14592 Len=0 TSval=3245063824 TSecr=632920632
101 102 816.560034 178.62.227.110 -> 213.133.111.200 TCP 66 [TCP Retransmission] bgp > 50667 [FIN, ACK] Seq=1 Ack=1 Win=14592 Len=0 TSval=3245077376 TSecr=632920632
102 103 818.992048 178.62.227.110 -> 213.133.111.200 BGP 111 [TCP Retransmission] OPEN Message
103 104 843.632051 178.62.227.110 -> 213.133.111.200 TCP 66 [TCP Retransmission] bgp > 50667 [FIN, ACK] Seq=1 Ack=1 Win=14592 Len=0 TSval=3245104448 TSecr=632920632
104 105 873.392056 178.62.227.110 -> 213.133.111.200 BGP 111 [TCP Retransmission] OPEN Message
105 106 982.064009 178.62.227.110 -> 213.133.111.200 BGP 111 [TCP Retransmission] OPEN Message
106 107 1004.622633 178.62.227.110 -> 213.133.111.200 BGP 87 NOTIFICATION Message
107 108 1019.624036 178.62.227.110 -> 213.133.111.200 TCP 74 57586 > bgp [SYN] Seq=0 Win=14600 Len=0 MSS=1460 SACK_PERM=1 TSval=3245280440 TSecr=0 WS=256
109 1019.635364 213.133.111.200 -> 178.62.227.110 TCP 74 bgp > 57586 [SYN, ACK] Seq=0 Ack=1 Win=14480 Len=0 MSS=1460 SACK_PERM=1 TSval=633150801 TSecr=3245280440 WS=128
110 1019.635451 178.62.227.110 -> 213.133.111.200 TCP 66 57586 > bgp [ACK] Seq=1 Ack=1 Win=14848 Len=0 TSval=3245280451 TSecr=633150801
111 1019.636314 178.62.227.110 -> 213.133.111.200 BGP 111 OPEN Message
112 1019.846999 178.62.227.110 -> 213.133.111.200 BGP 111 [TCP Retransmission] OPEN Message
113 1020.058004 178.62.227.110 -> 213.133.111.200 BGP 111 [TCP Retransmission] OPEN Message
113 114 1020.480963 178.62.227.110 -> 213.133.111.200 BGP 111 [TCP Retransmission] OPEN Message
114 115 1021.328027 178.62.227.110 -> 213.133.111.200 BGP 111 [TCP Retransmission] OPEN Message
115 116 1023.020015 178.62.227.110 -> 213.133.111.200 BGP 111 [TCP Retransmission] OPEN Message
116 117 1026.400029 178.62.227.110 -> 213.133.111.200 BGP 111 [TCP Retransmission] OPEN Message
117 118 1033.168054 178.62.227.110 -> 213.133.111.200 BGP 111 [TCP Retransmission] OPEN Message
118 119 1044.467157 213.133.111.200 -> 178.62.227.110 TCP 74 50668 > bgp [SYN] Seq=0 Win=14600 Len=0 MSS=1460 SACK_PERM=1 TSval=633175633 TSecr=0 WS=128
120 1044.467264 178.62.227.110 -> 213.133.111.200 TCP 74 bgp > 50668 [SYN, ACK] Seq=0 Ack=1 Win=14480 Len=0 MSS=1460 SACK_PERM=1 TSval=3245305283 TSecr=633175633 WS=256
121 1044.478535 213.133.111.200 -> 178.62.227.110 TCP 66 50668 > bgp [ACK] Seq=1 Ack=1 Win=14720 Len=0 TSval=633175645 TSecr=3245305283
122 1044.479286 178.62.227.110 -> 213.133.111.200 TCP 66 bgp > 50668 [FIN, ACK] Seq=1 Ack=1 Win=14592 Len=0 TSval=3245305295 TSecr=633175645
122 123 1044.901005 178.62.227.110 -> 213.133.111.200 TCP 66 [TCP Retransmission] bgp > 50668 [FIN, ACK] Seq=1 Ack=1 Win=14592 Len=0 TSval=3245305717 TSecr=633175645
124 1045.324027 178.62.227.110 -> 213.133.111.200 TCP 66 [TCP Retransmission] bgp > 50668 [FIN, ACK] Seq=1 Ack=1 Win=14592 Len=0 TSval=3245306140 TSecr=633175645
124 125 1046.170026 178.62.227.110 -> 213.133.111.200 TCP 66 [TCP Retransmission] bgp > 50668 [FIN, ACK] Seq=1 Ack=1 Win=14592 Len=0 TSval=3245306986 TSecr=633175645
125 126 1046.704052 178.62.227.110 -> 213.133.111.200 BGP 111 [TCP Retransmission] OPEN Message
126 127 1047.864026 178.62.227.110 -> 213.133.111.200 TCP 66 [TCP Retransmission] bgp > 50668 [FIN, ACK] Seq=1 Ack=1 Win=14592 Len=0 TSval=3245308680 TSecr=633175645
127 128 1051.248024 178.62.227.110 -> 213.133.111.200 TCP 66 [TCP Retransmission] bgp > 50668 [FIN, ACK] Seq=1 Ack=1 Win=14592 Len=0 TSval=3245312064 TSecr=633175645
128 129 1058.016035 178.62.227.110 -> 213.133.111.200 TCP 66 [TCP Retransmission] bgp > 50668 [FIN, ACK] Seq=1 Ack=1 Win=14592 Len=0 TSval=3245318832 TSecr=633175645
129 130 1071.536015 178.62.227.110 -> 213.133.111.200 TCP 66 [TCP Retransmission] bgp > 50668 [FIN, ACK] Seq=1 Ack=1 Win=14592 Len=0 TSval=3245332352 TSecr=633175645
130 131 1073.776041 178.62.227.110 -> 213.133.111.200 BGP 111 [TCP Retransmission] OPEN Message
131 132 1098.608058 178.62.227.110 -> 213.133.111.200 TCP 66 [TCP Retransmission] bgp > 50668 [FIN, ACK] Seq=1 Ack=1 Win=14592 Len=0 TSval=3245359424 TSecr=633175645
132 133 1127.984036 178.62.227.110 -> 213.133.111.200 BGP 111 [TCP Retransmission] OPEN Message
133 134 1236.272208 178.62.227.110 -> 213.133.111.200 BGP 111 [TCP Retransmission] OPEN Message
134 135 1259.637302 178.62.227.110 -> 213.133.111.200 BGP 87 NOTIFICATION Message
135 136 1274.638992 178.62.227.110 -> 213.133.111.200 TCP 74 57587 > bgp [SYN] Seq=0 Win=14600 Len=0 MSS=1460 SACK_PERM=1 TSval=3245535454 TSecr=0 WS=256
137 1274.650818 213.133.111.200 -> 178.62.227.110 TCP 74 bgp > 57587 [SYN, ACK] Seq=0 Ack=1 Win=14480 Len=0 MSS=1460 SACK_PERM=1 TSval=633405819 TSecr=3245535454 WS=128
138 1274.650959 178.62.227.110 -> 213.133.111.200 TCP 66 57587 > bgp [ACK] Seq=1 Ack=1 Win=14848 Len=0 TSval=3245535466 TSecr=633405819
139 1274.651510 178.62.227.110 -> 213.133.111.200 BGP 111 OPEN Message
140 1274.863023 178.62.227.110 -> 213.133.111.200 BGP 111 [TCP Retransmission] OPEN Message
140 141 1275.075021 178.62.227.110 -> 213.133.111.200 BGP 111 [TCP Retransmission] OPEN Message
142 1275.500021 178.62.227.110 -> 213.133.111.200 BGP 111 [TCP Retransmission] OPEN Message
142 143 1276.350125 178.62.227.110 -> 213.133.111.200 BGP 111 [TCP Retransmission] OPEN Message
143 144 1278.048020 178.62.227.110 -> 213.133.111.200 BGP 111 [TCP Retransmission] OPEN Message
144 145 1281.448068 178.62.227.110 -> 213.133.111.200 BGP 111 [TCP Retransmission] OPEN Message
145 146 1288.240016 178.62.227.110 -> 213.133.111.200 BGP 111 [TCP Retransmission] OPEN Message
146 147 1299.476623 213.133.111.200 -> 178.62.227.110 TCP 74 50669 > bgp [SYN] Seq=0 Win=14600 Len=0 MSS=1460 SACK_PERM=1 TSval=633430646 TSecr=0 WS=128
148 1299.476855 178.62.227.110 -> 213.133.111.200 TCP 74 bgp > 50669 [SYN, ACK] Seq=0 Ack=1 Win=14480 Len=0 MSS=1460 SACK_PERM=1 TSval=3245560292 TSecr=633430646 WS=256
149 1299.488578 213.133.111.200 -> 178.62.227.110 TCP 66 50669 > bgp [ACK] Seq=1 Ack=1 Win=14720 Len=0 TSval=633430657 TSecr=3245560292
150 1299.489111 178.62.227.110 -> 213.133.111.200 TCP 66 bgp > 50669 [FIN, ACK] Seq=1 Ack=1 Win=14592 Len=0 TSval=3245560305 TSecr=633430657
150 151 1299.913057 178.62.227.110 -> 213.133.111.200 TCP 66 [TCP Retransmission] bgp > 50669 [FIN, ACK] Seq=1 Ack=1 Win=14592 Len=0 TSval=3245560729 TSecr=633430657
152 1300.338040 178.62.227.110 -> 213.133.111.200 TCP 66 [TCP Retransmission] bgp > 50669 [FIN, ACK] Seq=1 Ack=1 Win=14592 Len=0 TSval=3245561154 TSecr=633430657
152 153 1301.188026 178.62.227.110 -> 213.133.111.200 TCP 66 [TCP Retransmission] bgp > 50669 [FIN, ACK] Seq=1 Ack=1 Win=14592 Len=0 TSval=3245562004 TSecr=633430657
153 154 1301.840012 178.62.227.110 -> 213.133.111.200 BGP 111 [TCP Retransmission] OPEN Message
154 155 1302.888021 178.62.227.110 -> 213.133.111.200 TCP 66 [TCP Retransmission] bgp > 50669 [FIN, ACK] Seq=1 Ack=1 Win=14592 Len=0 TSval=3245563704 TSecr=633430657
155 156 1306.288037 178.62.227.110 -> 213.133.111.200 TCP 66 [TCP Retransmission] bgp > 50669 [FIN, ACK] Seq=1 Ack=1 Win=14592 Len=0 TSval=3245567104 TSecr=633430657
156 157 1313.088037 178.62.227.110 -> 213.133.111.200 TCP 66 [TCP Retransmission] bgp > 50669 [FIN, ACK] Seq=1 Ack=1 Win=14592 Len=0 TSval=3245573904 TSecr=633430657
157 158 1326.704050 178.62.227.110 -> 213.133.111.200 TCP 66 [TCP Retransmission] bgp > 50669 [FIN, ACK] Seq=1 Ack=1 Win=14592 Len=0 TSval=3245587520 TSecr=633430657
158 159 1329.072029 178.62.227.110 -> 213.133.111.200 BGP 111 [TCP Retransmission] OPEN Message
159 160 1353.904158 178.62.227.110 -> 213.133.111.200 TCP 66 [TCP Retransmission] bgp > 50669 [FIN, ACK] Seq=1 Ack=1 Win=14592 Len=0 TSval=3245614720 TSecr=633430657
160 161 1383.472021 178.62.227.110 -> 213.133.111.200 BGP 111 [TCP Retransmission] OPEN Message
161 162 1431.390647 178.62.227.110 -> 213.133.111.200 TCP 66 57587 > bgp [FIN, ACK] Seq=46 Ack=1 Win=14848 Len=0 TSval=3245692206 TSecr=633405819
162 
```
Both server correctly listen 179 socket:
```bash
netstat -lnpt|grep 179
tcp        0      0 0.0.0.0:179                 0.0.0.0:*                   LISTEN      170307/gobgpd       
tcp        0      0 :::179                      :::*                        LISTEN      170307/gobgpd       
```

And second:
```bash
netstat -lnpt|grep 179
tcp        0      0 0.0.0.0:179             0.0.0.0:*               LISTEN      17097/gobgpd        
tcp6       0      0 :::179                  :::*                    LISTEN      17097/gobgpd      
```

I have checked connectivity between servers on 179 port with telnet and everything works nice. But gobgpd do not saw each other :(

Thanks for help!

**Comment by ishidawataru** [comment]
Hi,

Could you try with the same AS(iBGP setting)?
For an eBGP peer, ttl is set to 1 by default.

**Comment by ishidawataru** [comment]
like this
```toml
[Global]
  [Global.GlobalConfig]
    As = 65001
    RouterId = "178.62.227.110"

[Neighbors]
  [[Neighbors.NeighborList]]
    [Neighbors.NeighborList.NeighborConfig]
      NeighborAddress = "213.133.111.200"
      PeerAs = 65001
```

**Comment by pavel-odintsov** [comment]
Thanks!

Got it:
```bash
gobgp neighbor
Peer              AS  Up/Down State       |#Advertised Received Accepted
178.62.227.110 65001 00:11:29 Establ      |          0        0        0
```

```bash
gobgp neighbor
Peer               AS  Up/Down State       |#Advertised Received Accepted
213.133.111.200 65001 00:11:24 Establ      |          0        0        0
```

Do you have any plans to add multihop BGP option? It's really important in case when we use tool as Route Reflector or deploy multi hop BGP.

**Comment by ishidawataru** [comment]
Voila! https://github.com/osrg/gobgp/commit/f8d437ec0ea65656ca4c6d81ec48fe0f7099c60e

**Comment by pavel-odintsov** [comment]
That's awesome! I have never saw so fast fixes! :)

So what about some way to disable custom TTL configuration completely with configuration option? I have use BGP only for announcing routes in really different networks and TTL configuration will be a pain. We use firewall for securing BGP session.

**Comment by ishidawataru** [comment]
Hmm, GoBGP is using [OpenConfig](http://www.openconfig.net/) YANG model as a configuration model, and OpenConfig doesn't have such configuration knob. Though it's possible to expand OpenConfig's YANG model, we want to avoid such custom extension as much as possible.

**Comment by pavel-odintsov** [comment]
Hello!

Completely agree! but what about https://github.com/YangModels/yang/blob/master/experimental/openconfig/bgp/bgp.yang#L322 ?

Looks like it's what we are looking for!

**Comment by pavel-odintsov** [comment]
In other worlds we could remove explicit declaration of TTL from configuration and any checks should be disabled.

**Comment by ishidawataru** [comment]
Ah, now I (and @fujita ) got your point.

https://github.com/osrg/gobgp/commit/d83a16ed00cd1e3617fe06d9a1b1a1002406ccef

Now custom TTL configuration is disabled when you just specify `EbgpMultihopConfig.Enabled = true`

```toml
[Neighbors]
  [[Neighbors.NeighborList]]
    [Neighbors.NeighborList.NeighborConfig]
      PeerAs = 65001
      NeighborAddress = "10.0.255.1"
    [Neighbors.NeighborList.EbgpMultihop]
      [Neighbors.NeighborList.EbgpMultihop.EbgpMultihopConfig]
        Enabled = true
```

**Comment by pavel-odintsov** [comment]
Perfect work! Thanks you so much! Will test soon!

**Comment by pavel-odintsov** [comment]
Hello!

Works perfectly!

```bash
[Global]
  [Global.GlobalConfig]
    As = 65002
    RouterId = "178.62.227.110"

[Neighbors]
  [[Neighbors.NeighborList]]
    [Neighbors.NeighborList.NeighborConfig]
      NeighborAddress = "213.133.111.200"
      PeerAs = 65001
    [Neighbors.NeighborList.EbgpMultihop]
      [Neighbors.NeighborList.EbgpMultihop.EbgpMultihopConfig]
        Enabled = true
```

```bash
[Global]
  [Global.GlobalConfig]
    As = 65001
    RouterId = "213.133.111.200"

[Neighbors]
  [[Neighbors.NeighborList]]
    [Neighbors.NeighborList.NeighborConfig]
      NeighborAddress = "178.62.227.110"
      PeerAs = 65002
    [Neighbors.NeighborList.EbgpMultihop]
      [Neighbors.NeighborList.EbgpMultihop.EbgpMultihopConfig]
        Enabled = true
```

Connected correctly:
````bash
 gobgpd 
{"level":"info","msg":"Peer 213.133.111.200 is added","time":"2015-09-03T19:33:31+03:00"}
{"Key":"213.133.111.200","State":5,"Topic":"Peer","level":"info","msg":"Peer Up","time":"2015-09-03T19:33:41+03:00"}
```

Second:
```bash
 gobgpd 
{"level":"info","msg":"Peer 178.62.227.110 is added","time":"2015-09-03T18:33:27+02:00"}
{"Key":"178.62.227.110","State":5,"Topic":"Peer","level":"info","msg":"Peer Up","time":"2015-09-03T18:33:33+02:00"}
```

**Comment by ishidawataru** [comment]
Thanks for the report!
